Comment,Sentiment,tokens,filtered_tokens,processed_text
இந்த வயசுல உனக்கு என்ன படம் வேண்டி இருக்கு வீட்டுக்கு போய் பிரஸர் மாத்திரை சாப்டு தூங்கு,-1,"['இந்த', 'வயசுல', 'உனக்கு', 'என்ன', 'படம்', 'வேண்டி', 'இருக்கு', 'வீட்டுக்கு', 'போய்', 'பிரஸர்', 'மாத்திரை', 'சாப்டு', 'தூங்கு']","['இந்த', 'வயசுல', 'உனக்கு', 'என்ன', 'படம்', 'வேண்டி', 'இருக்கு', 'வீட்டுக்கு', 'போய்', 'பிரஸர்', 'மாத்திரை', 'சாப்டு', 'தூங்கு']",இந்த வயசுல உனக்கு என்ன படம் வேண்டி இருக்கு வீட்டுக்கு போய் பிரஸர் மாத்திரை சாப்டு தூங்கு
இவர பாத்தா படம் பாத்துட்டு ரிவியூ சொல்ற மாதிரி தெரியல ரிவியூ சொல்றதுக்காகவே படம் பாத்துட்டு வந்து கத்துற மாதிரி இருக்குது,-1,"['இவர', 'பாத்தா', 'படம்', 'பாத்துட்டு', 'ரிவியூ', 'சொல்ற', 'மாதிரி', 'தெரியல', 'ரிவியூ', 'சொல்றதுக்காகவே', 'படம்', 'பாத்துட்டு', 'வந்து', 'கத்துற', 'மாதிரி', 'இருக்குது']","['இவர', 'பாத்தா', 'படம்', 'பாத்துட்டு', 'ரிவியூ', 'சொல்ற', 'மாதிரி', 'தெரியல', 'ரிவியூ', 'சொல்றதுக்காகவே', 'படம்', 'பாத்துட்டு', 'வந்து', 'கத்துற', 'மாதிரி', 'இருக்குது']",இவர பாத்தா படம் பாத்துட்டு ரிவியூ சொல்ற மாதிரி தெரியல ரிவியூ சொல்றதுக்காகவே படம் பாத்துட்டு வந்து கத்துற மாதிரி இருக்குது
வேர்ல்ட் பெஸ்ட் படம் கங்குவா,0,"['வேர்ல்ட்', 'பெஸ்ட்', 'படம்', 'கங்குவா']","['வேர்ல்ட்', 'பெஸ்ட்', 'படம்', 'கங்குவா']",வேர்ல்ட் பெஸ்ட் படம் கங்குவா
படம் நல்லா தான் டா இருக்கு கிறுக்கு நீ ஒரு எடுத்து பாரு டா சொட்ட கிறுக்கு கூ,-1,"['படம்', 'நல்லா', 'தான்', 'டா', 'இருக்கு', 'கிறுக்கு', 'நீ', 'ஒரு', 'எடுத்து', 'பாரு', 'டா', 'சொட்ட', 'கிறுக்கு', 'கூ']","['படம்', 'நல்லா', 'தான்', 'டா', 'இருக்கு', 'கிறுக்கு', 'நீ', 'எடுத்து', 'பாரு', 'டா', 'சொட்ட', 'கிறுக்கு', 'கூ']",படம் நல்லா தான் டா இருக்கு கிறுக்கு நீ எடுத்து பாரு டா சொட்ட கிறுக்கு கூ
மகா பிரபு நீங்க இங்கேயும் வந்துட்டீங்களா ஒரு படம் எடுத்து தியேட்டர்ல ரிலீஸ் பண்ணி பாரு அந்த வலியும் கஷ்டமும் தெரியும் ரூபாய் கொடுத்து படம் பார்க்க வந்து எதோ டிஸ்ட்ரிபியூட்டர் மாதிரி கவலை படுற மண்டையில முடி தான் இல்லை என்றாலும் மூளையும் முளைக்கவில்லை நாம் இவரை பாத்துக்கலாம்,-1,"['மகா', 'பிரபு', 'நீங்க', 'இங்கேயும்', 'வந்துட்டீங்களா', 'ஒரு', 'படம்', 'எடுத்து', 'தியேட்டர்ல', 'ரிலீஸ்', 'பண்ணி', 'பாரு', 'அந்த', 'வலியும்', 'கஷ்டமும்', 'தெரியும்', 'ரூபாய்', 'கொடுத்து', 'படம்', 'பார்க்க', 'வந்து', 'எதோ', 'டிஸ்ட்ரிபியூட்டர்', 'மாதிரி', 'கவலை', 'படுற', 'மண்டையில', 'முடி', 'தான்', 'இல்லை', 'என்றாலும்', 'மூளையும்', 'முளைக்கவில்லை', 'நாம்', 'இவரை', 'பாத்துக்கலாம்']","['மகா', 'பிரபு', 'நீங்க', 'இங்கேயும்', 'வந்துட்டீங்களா', 'படம்', 'எடுத்து', 'தியேட்டர்ல', 'ரிலீஸ்', 'பண்ணி', 'பாரு', 'அந்த', 'வலியும்', 'கஷ்டமும்', 'தெரியும்', 'ரூபாய்', 'கொடுத்து', 'படம்', 'பார்க்க', 'வந்து', 'எதோ', 'டிஸ்ட்ரிபியூட்டர்', 'மாதிரி', 'கவலை', 'படுற', 'மண்டையில', 'முடி', 'தான்', 'என்றாலும்', 'மூளையும்', 'முளைக்கவில்லை', 'நாம்', 'இவரை', 'பாத்துக்கலாம்']",மகா பிரபு நீங்க இங்கேயும் வந்துட்டீங்களா படம் எடுத்து தியேட்டர்ல ரிலீஸ் பண்ணி பாரு அந்த வலியும் கஷ்டமும் தெரியும் ரூபாய் கொடுத்து படம் பார்க்க வந்து எதோ டிஸ்ட்ரிபியூட்டர் மாதிரி கவலை படுற மண்டையில முடி தான் என்றாலும் மூளையும் முளைக்கவில்லை நாம் இவரை பாத்துக்கலாம்
அருமையான பதிவு கங்கு வாவை கிழித்து விட்டீர்கள்,-1,"['அருமையான', 'பதிவு', 'கங்கு', 'வாவை', 'கிழித்து', 'விட்டீர்கள்']","['அருமையான', 'பதிவு', 'கங்கு', 'வாவை', 'கிழித்து', 'விட்டீர்கள்']",அருமையான பதிவு கங்கு வாவை கிழித்து விட்டீர்கள்
அவசரப்பட்டு பார்த்து விட்டார் இது போல் ரத்த கொதிப்புள்ளவர்கள் ஒரு வாரம் கழிச்சு மக்கள் கருத்து கேட்ட பின் சென்றயிருக்க வேண்டும்,-1,"['அவசரப்பட்டு', 'பார்த்து', 'விட்டார்', 'இது', 'போல்', 'ரத்த', 'கொதிப்புள்ளவர்கள்', 'ஒரு', 'வாரம்', 'கழிச்சு', 'மக்கள்', 'கருத்து', 'கேட்ட', 'பின்', 'சென்றயிருக்க', 'வேண்டும்']","['அவசரப்பட்டு', 'பார்த்து', 'விட்டார்', 'போல்', 'ரத்த', 'கொதிப்புள்ளவர்கள்', 'வாரம்', 'கழிச்சு', 'மக்கள்', 'கருத்து', 'கேட்ட', 'பின்', 'சென்றயிருக்க', 'வேண்டும்']",அவசரப்பட்டு பார்த்து விட்டார் போல் ரத்த கொதிப்புள்ளவர்கள் வாரம் கழிச்சு மக்கள் கருத்து கேட்ட பின் சென்றயிருக்க வேண்டும்
ஒட்டு மொத்த படத்தையும் காலி பண்ணது இவரு தாண்டா,-1,"['ஒட்டு', 'மொத்த', 'படத்தையும்', 'காலி', 'பண்ணது', 'இவரு', 'தாண்டா']","['ஒட்டு', 'மொத்த', 'படத்தையும்', 'காலி', 'பண்ணது', 'இவரு', 'தாண்டா']",ஒட்டு மொத்த படத்தையும் காலி பண்ணது இவரு தாண்டா
இவன் பொண்டாட்டி மகள் இரண்டு பேரையும் ஒழுத்துட்டு காசு கொடுக்க மாட்டேன்னு படம் பார்க்கடிக்கட் கொடுத்தேன் அதான் கத்தறான்,-1,"['இவன்', 'பொண்டாட்டி', 'மகள்', 'இரண்டு', 'பேரையும்', 'ஒழுத்துட்டு', 'காசு', 'கொடுக்க', 'மாட்டேன்னு', 'படம்', 'பார்க்கடிக்கட்', 'கொடுத்தேன்', 'அதான்', 'கத்தறான்']","['இவன்', 'பொண்டாட்டி', 'மகள்', 'இரண்டு', 'பேரையும்', 'ஒழுத்துட்டு', 'காசு', 'கொடுக்க', 'மாட்டேன்னு', 'படம்', 'பார்க்கடிக்கட்', 'கொடுத்தேன்', 'அதான்', 'கத்தறான்']",இவன் பொண்டாட்டி மகள் இரண்டு பேரையும் ஒழுத்துட்டு காசு கொடுக்க மாட்டேன்னு படம் பார்க்கடிக்கட் கொடுத்தேன் அதான் கத்தறான்
அமரன் மயிறு மாதிரி இருந்தது,0,"['அமரன்', 'மயிறு', 'மாதிரி', 'இருந்தது']","['அமரன்', 'மயிறு', 'மாதிரி', 'இருந்தது']",அமரன் மயிறு மாதிரி இருந்தது
திட்டமிட்ட சதி,1,"['திட்டமிட்ட', 'சதி']","['திட்டமிட்ட', 'சதி']",திட்டமிட்ட சதி
தாத்தா மயிரு சொல்லும் அளவிற்கு தாத்தா மண்டைல ஒண்ணும் இல்லையெ,-1,"['தாத்தா', 'மயிரு', 'சொல்லும்', 'அளவிற்கு', 'தாத்தா', 'மண்டைல', 'ஒண்ணும்', 'இல்லையெ']","['தாத்தா', 'மயிரு', 'சொல்லும்', 'அளவிற்கு', 'தாத்தா', 'மண்டைல', 'ஒண்ணும்', 'இல்லையெ']",தாத்தா மயிரு சொல்லும் அளவிற்கு தாத்தா மண்டைல ஒண்ணும் இல்லையெ
பாவம் பரிதாபம் உணர்வு உணர்ச்சி உற்சாகம் உற்பத்தி உறுப்பினர் உடைந்த மனது ஒட்டாது,0,"['பாவம்', 'பரிதாபம்', 'உணர்வு', 'உணர்ச்சி', 'உற்சாகம்', 'உற்பத்தி', 'உறுப்பினர்', 'உடைந்த', 'மனது', 'ஒட்டாது']","['பாவம்', 'பரிதாபம்', 'உணர்வு', 'உணர்ச்சி', 'உற்சாகம்', 'உற்பத்தி', 'உறுப்பினர்', 'உடைந்த', 'மனது', 'ஒட்டாது']",பாவம் பரிதாபம் உணர்வு உணர்ச்சி உற்சாகம் உற்பத்தி உறுப்பினர் உடைந்த மனது ஒட்டாது
எதுக்கு இது போல எல்லாம் போசுரிங்க,-1,"['எதுக்கு', 'இது', 'போல', 'எல்லாம்', 'போசுரிங்க']","['எதுக்கு', 'போல', 'எல்லாம்', 'போசுரிங்க']",எதுக்கு போல எல்லாம் போசுரிங்க
நீய் தான் மெண்டல்,1,"['நீய்', 'தான்', 'மெண்டல்']","['நீய்', 'தான்', 'மெண்டல்']",நீய் தான் மெண்டல்
அய்யா பெரியவரே ரகசியமாக பாதுகாப்பாக இருங்கள் உங்களை தேடிக்கிட்டு இருக்காங்கலாம்,0,"['அய்யா', 'பெரியவரே', 'ரகசியமாக', 'பாதுகாப்பாக', 'இருங்கள்', 'உங்களை', 'தேடிக்கிட்டு', 'இருக்காங்கலாம்']","['அய்யா', 'பெரியவரே', 'ரகசியமாக', 'பாதுகாப்பாக', 'இருங்கள்', 'உங்களை', 'தேடிக்கிட்டு', 'இருக்காங்கலாம்']",அய்யா பெரியவரே ரகசியமாக பாதுகாப்பாக இருங்கள் உங்களை தேடிக்கிட்டு இருக்காங்கலாம்
பதிவு சூப்பர்,1,"['பதிவு', 'சூப்பர்']","['பதிவு', 'சூப்பர்']",பதிவு சூப்பர்
அந்தப் பசையில் பசை இருக்காது அதனால் இந்த நம்பர் கண்ணாடி ஓட்டுற பசங்க கடையில கேளுங்க கிடைக்கும் அதை வாங்கி ஒட்டி ஓட்டுனேன் ஆறு வருஷமா அப்படியே இருக்குது,-1,"['அந்தப்', 'பசையில்', 'பசை', 'இருக்காது', 'அதனால்', 'இந்த', 'நம்பர்', 'கண்ணாடி', 'ஓட்டுற', 'பசங்க', 'கடையில', 'கேளுங்க', 'கிடைக்கும்', 'அதை', 'வாங்கி', 'ஒட்டி', 'ஓட்டுனேன்', 'ஆறு', 'வருஷமா', 'அப்படியே', 'இருக்குது']","['அந்தப்', 'பசையில்', 'பசை', 'இருக்காது', 'அதனால்', 'இந்த', 'நம்பர்', 'கண்ணாடி', 'ஓட்டுற', 'பசங்க', 'கடையில', 'கேளுங்க', 'கிடைக்கும்', 'அதை', 'வாங்கி', 'ஒட்டி', 'ஓட்டுனேன்', 'ஆறு', 'வருஷமா', 'அப்படியே', 'இருக்குது']",அந்தப் பசையில் பசை இருக்காது அதனால் இந்த நம்பர் கண்ணாடி ஓட்டுற பசங்க கடையில கேளுங்க கிடைக்கும் அதை வாங்கி ஒட்டி ஓட்டுனேன் ஆறு வருஷமா அப்படியே இருக்குது
நீங்க சொல்றது புரியல அது என்ன பசைனு புரியும் படி சொல்லவும்,-1,"['நீங்க', 'சொல்றது', 'புரியல', 'அது', 'என்ன', 'பசைனு', 'புரியும்', 'படி', 'சொல்லவும்']","['நீங்க', 'சொல்றது', 'புரியல', 'அது', 'என்ன', 'பசைனு', 'புரியும்', 'படி', 'சொல்லவும்']",நீங்க சொல்றது புரியல அது என்ன பசைனு புரியும் படி சொல்லவும்
சரிஒரு சந்தேகம் நீங்க ஒரு ப்ரோவா அல்லது பிரோவா,-1,"['சரிஒரு', 'சந்தேகம்', 'நீங்க', 'ஒரு', 'ப்ரோவா', 'அல்லது', 'பிரோவா']","['சரிஒரு', 'சந்தேகம்', 'நீங்க', 'ப்ரோவா', 'அல்லது', 'பிரோவா']",சரிஒரு சந்தேகம் நீங்க ப்ரோவா அல்லது பிரோவா
தகவல் கொடுத்துட்டேன்,-1,"['தகவல்', 'கொடுத்துட்டேன்']","['தகவல்', 'கொடுத்துட்டேன்']",தகவல் கொடுத்துட்டேன்
மட்டும் தனி,-1,"['மட்டும்', 'தனி']","['மட்டும்', 'தனி']",மட்டும் தனி
ஆப்செட் ப்ரோ,1,"['ஆப்செட்', 'ப்ரோ']","['ஆப்செட்', 'ப்ரோ']",ஆப்செட் ப்ரோ
தல ஐஸ் பால் ரூபாய் இருக்கு இல்லை,-1,"['தல', 'ஐஸ்', 'பால்', 'ரூபாய்', 'இருக்கு', 'இல்லை']","['தல', 'ஐஸ்', 'பால்', 'ரூபாய்', 'இருக்கு']",தல ஐஸ் பால் ரூபாய் இருக்கு
ஐய்யோ ஐய்ஐய்யோ,0,"['ஐய்யோ', 'ஐய்ஐய்யோ']","['ஐய்யோ', 'ஐய்ஐய்யோ']",ஐய்யோ ஐய்ஐய்யோ
பொருள்களின் விலை குறைவு தான் ஆனால் எக்ஸ்ட்ரா போடுகிறார்கள்,0,"['பொருள்களின்', 'விலை', 'குறைவு', 'தான்', 'ஆனால்', 'எக்ஸ்ட்ரா', 'போடுகிறார்கள்']","['பொருள்களின்', 'விலை', 'குறைவு', 'தான்', 'ஆனால்', 'எக்ஸ்ட்ரா', 'போடுகிறார்கள்']",பொருள்களின் விலை குறைவு தான் ஆனால் எக்ஸ்ட்ரா போடுகிறார்கள்
அந்த ஆப் பெயர் என்ன,-1,"['அந்த', 'ஆப்', 'பெயர்', 'என்ன']","['அந்த', 'ஆப்', 'பெயர்', 'என்ன']",அந்த ஆப் பெயர் என்ன
உங்களின் பேச்சு என் மூளையில் உள்ள பல எண்ணங்களை அகற்றி அமைதியாக கேட்க வைத்து என் மனமும் மூளையும் புதுப்பித்து புத்துணர்வு பெறுகிறது,1,"['உங்களின்', 'பேச்சு', 'என்', 'மூளையில்', 'உள்ள', 'பல', 'எண்ணங்களை', 'அகற்றி', 'அமைதியாக', 'கேட்க', 'வைத்து', 'என்', 'மனமும்', 'மூளையும்', 'புதுப்பித்து', 'புத்துணர்வு', 'பெறுகிறது']","['உங்களின்', 'பேச்சு', 'மூளையில்', 'உள்ள', 'பல', 'எண்ணங்களை', 'அகற்றி', 'அமைதியாக', 'கேட்க', 'வைத்து', 'மனமும்', 'மூளையும்', 'புதுப்பித்து', 'புத்துணர்வு', 'பெறுகிறது']",உங்களின் பேச்சு மூளையில் உள்ள பல எண்ணங்களை அகற்றி அமைதியாக கேட்க வைத்து மனமும் மூளையும் புதுப்பித்து புத்துணர்வு பெறுகிறது
நல்ல புத்தகங்களை தேர்ந்தெடுத்து படியுங்கள் ஒரு சில ஆண்டுகள் முதலில் நீங்கள் ரசியுங்கள் பின் அதையே நீங்கள் பேசுங்கள் உலகத்தில் உங்களை நீங்கள் ரசிக்க வைத்தீர்கள் என்றால் நீங்கள் தான் உங்களுக்கு முதல் ரசிகன் மற்றவர்கள் அந்த நிலைகளில் மெய்மறந்திருப்பார்கள் முயற்சியுங்கள்,1,"['நல்ல', 'புத்தகங்களை', 'தேர்ந்தெடுத்து', 'படியுங்கள்', 'ஒரு', 'சில', 'ஆண்டுகள்', 'முதலில்', 'நீங்கள்', 'ரசியுங்கள்', 'பின்', 'அதையே', 'நீங்கள்', 'பேசுங்கள்', 'உலகத்தில்', 'உங்களை', 'நீங்கள்', 'ரசிக்க', 'வைத்தீர்கள்', 'என்றால்', 'நீங்கள்', 'தான்', 'உங்களுக்கு', 'முதல்', 'ரசிகன்', 'மற்றவர்கள்', 'அந்த', 'நிலைகளில்', 'மெய்மறந்திருப்பார்கள்', 'முயற்சியுங்கள்']","['நல்ல', 'புத்தகங்களை', 'தேர்ந்தெடுத்து', 'படியுங்கள்', 'சில', 'ஆண்டுகள்', 'முதலில்', 'நீங்கள்', 'ரசியுங்கள்', 'பின்', 'அதையே', 'நீங்கள்', 'பேசுங்கள்', 'உலகத்தில்', 'உங்களை', 'நீங்கள்', 'ரசிக்க', 'வைத்தீர்கள்', 'என்றால்', 'நீங்கள்', 'தான்', 'உங்களுக்கு', 'முதல்', 'ரசிகன்', 'மற்றவர்கள்', 'அந்த', 'நிலைகளில்', 'மெய்மறந்திருப்பார்கள்', 'முயற்சியுங்கள்']",நல்ல புத்தகங்களை தேர்ந்தெடுத்து படியுங்கள் சில ஆண்டுகள் முதலில் நீங்கள் ரசியுங்கள் பின் அதையே நீங்கள் பேசுங்கள் உலகத்தில் உங்களை நீங்கள் ரசிக்க வைத்தீர்கள் என்றால் நீங்கள் தான் உங்களுக்கு முதல் ரசிகன் மற்றவர்கள் அந்த நிலைகளில் மெய்மறந்திருப்பார்கள் முயற்சியுங்கள்
நன்றி அம்மா என் மனக்குழப்பம் விலகியது,-1,"['நன்றி', 'அம்மா', 'என்', 'மனக்குழப்பம்', 'விலகியது']","['நன்றி', 'அம்மா', 'மனக்குழப்பம்', 'விலகியது']",நன்றி அம்மா மனக்குழப்பம் விலகியது
உண்மை,0,['உண்மை'],['உண்மை'],உண்மை
