Comment,Sentiment,tokens,filtered_tokens,processed_text
ஒரு ஜாதி திருநெல்வேலி ல இருக்கு ஒருத்தனுக்கு ஒருத்தன் அடிச்சிக்கிருவாங்க இதான் உண்மை,-1,"['ஒரு', 'ஜாதி', 'திருநெல்வேலி', 'ல', 'இருக்கு', 'ஒருத்தனுக்கு', 'ஒருத்தன்', 'அடிச்சிக்கிருவாங்க', 'இதான்', 'உண்மை']","['ஜாதி', 'திருநெல்வேலி', 'ல', 'இருக்கு', 'ஒருத்தனுக்கு', 'ஒருத்தன்', 'அடிச்சிக்கிருவாங்க', 'இதான்', 'உண்மை']",ஜாதி திருநெல்வேலி ல இருக்கு ஒருத்தனுக்கு ஒருத்தன் அடிச்சிக்கிருவாங்க இதான் உண்மை
திருநெல்வேலினாளே கராத்தே செல்வின் நாடார் ராக்கெட் ராஜா தான்,1,"['திருநெல்வேலினாளே', 'கராத்தே', 'செல்வின்', 'நாடார்', 'ராக்கெட்', 'ராஜா', 'தான்']","['திருநெல்வேலினாளே', 'கராத்தே', 'செல்வின்', 'நாடார்', 'ராக்கெட்', 'ராஜா', 'தான்']",திருநெல்வேலினாளே கராத்தே செல்வின் நாடார் ராக்கெட் ராஜா தான்
திருநெல்வேலி மாஸ்ஸ்ஸ்ஸ்ஸ் பொண்ணு,1,"['திருநெல்வேலி', 'மாஸ்ஸ்ஸ்ஸ்ஸ்', 'பொண்ணு']","['திருநெல்வேலி', 'மாஸ்ஸ்ஸ்ஸ்ஸ்', 'பொண்ணு']",திருநெல்வேலி மாஸ்ஸ்ஸ்ஸ்ஸ் பொண்ணு
ஏலே,0,['ஏலே'],['ஏலே'],ஏலே
ஏலே தான் திருநெல்வேலிக்கு அடையாளம் திருநெல்வேலிக்கே நாடார்தாம்லே அடையாளம்,-1,"['ஏலே', 'தான்', 'திருநெல்வேலிக்கு', 'அடையாளம்', 'திருநெல்வேலிக்கே', 'நாடார்தாம்லே', 'அடையாளம்']","['ஏலே', 'தான்', 'திருநெல்வேலிக்கு', 'அடையாளம்', 'திருநெல்வேலிக்கே', 'நாடார்தாம்லே', 'அடையாளம்']",ஏலே தான் திருநெல்வேலிக்கு அடையாளம் திருநெல்வேலிக்கே நாடார்தாம்லே அடையாளம்
திருநெல்வேலி நாடார்லே,1,"['திருநெல்வேலி', 'நாடார்லே']","['திருநெல்வேலி', 'நாடார்லே']",திருநெல்வேலி நாடார்லே
திருநெல்வேலி நாலே ௭ங்க ௮ன்னண் செல்வின் நாடார் தான்,1,"['திருநெல்வேலி', 'நாலே', '௭ங்க', '௮ன்னண்', 'செல்வின்', 'நாடார்', 'தான்']","['திருநெல்வேலி', 'நாலே', '௭ங்க', '௮ன்னண்', 'செல்வின்', 'நாடார்', 'தான்']",திருநெல்வேலி நாலே ௭ங்க ௮ன்னண் செல்வின் நாடார் தான்
இதில் என்ன நார்த்தீகம் இவரும் ஒரு மனிதர் தான் உழைத்து பிழைக்கிறார் எல்லா சமூகத்தினரும் இவரை அன்பு காட்டி மதிக்கிறார்கள் திராவிட கழகத்தை பின் பற்றி பிராமண சமூகத்தை வசை பாடும் சிலர் இவரை பார்த்து வெட்கி தலை குனிய வேண்டும் இவர் முற்படுத்த பட்ட பிரிவு என்பதால் இவருக்கு எந்த வித அரசாங்க சலுகைகளும் மறுக்க படுகின்றன மக்கள் காட்டும் அன்பு தான் இவர் சொத்து திராவிட அரசியல் கட்சிகள் உணரட்டும்,-1,"['இதில்', 'என்ன', 'நார்த்தீகம்', 'இவரும்', 'ஒரு', 'மனிதர்', 'தான்', 'உழைத்து', 'பிழைக்கிறார்', 'எல்லா', 'சமூகத்தினரும்', 'இவரை', 'அன்பு', 'காட்டி', 'மதிக்கிறார்கள்', 'திராவிட', 'கழகத்தை', 'பின்', 'பற்றி', 'பிராமண', 'சமூகத்தை', 'வசை', 'பாடும்', 'சிலர்', 'இவரை', 'பார்த்து', 'வெட்கி', 'தலை', 'குனிய', 'வேண்டும்', 'இவர்', 'முற்படுத்த', 'பட்ட', 'பிரிவு', 'என்பதால்', 'இவருக்கு', 'எந்த', 'வித', 'அரசாங்க', 'சலுகைகளும்', 'மறுக்க', 'படுகின்றன', 'மக்கள்', 'காட்டும்', 'அன்பு', 'தான்', 'இவர்', 'சொத்து', 'திராவிட', 'அரசியல்', 'கட்சிகள்', 'உணரட்டும்']","['இதில்', 'என்ன', 'நார்த்தீகம்', 'இவரும்', 'மனிதர்', 'தான்', 'உழைத்து', 'பிழைக்கிறார்', 'எல்லா', 'சமூகத்தினரும்', 'இவரை', 'அன்பு', 'காட்டி', 'மதிக்கிறார்கள்', 'திராவிட', 'கழகத்தை', 'பின்', 'பற்றி', 'பிராமண', 'சமூகத்தை', 'வசை', 'பாடும்', 'சிலர்', 'இவரை', 'பார்த்து', 'வெட்கி', 'தலை', 'குனிய', 'வேண்டும்', 'இவர்', 'முற்படுத்த', 'பட்ட', 'பிரிவு', 'என்பதால்', 'இவருக்கு', 'எந்த', 'வித', 'அரசாங்க', 'சலுகைகளும்', 'மறுக்க', 'படுகின்றன', 'மக்கள்', 'காட்டும்', 'அன்பு', 'தான்', 'இவர்', 'சொத்து', 'திராவிட', 'அரசியல்', 'கட்சிகள்', 'உணரட்டும்']",இதில் என்ன நார்த்தீகம் இவரும் மனிதர் தான் உழைத்து பிழைக்கிறார் எல்லா சமூகத்தினரும் இவரை அன்பு காட்டி மதிக்கிறார்கள் திராவிட கழகத்தை பின் பற்றி பிராமண சமூகத்தை வசை பாடும் சிலர் இவரை பார்த்து வெட்கி தலை குனிய வேண்டும் இவர் முற்படுத்த பட்ட பிரிவு என்பதால் இவருக்கு எந்த வித அரசாங்க சலுகைகளும் மறுக்க படுகின்றன மக்கள் காட்டும் அன்பு தான் இவர் சொத்து திராவிட அரசியல் கட்சிகள் உணரட்டும்
ஓவர் ரேட்,1,"['ஓவர்', 'ரேட்']","['ஓவர்', 'ரேட்']",ஓவர் ரேட்
தங்கள் வார்த்தைகள் ஒவ்வொன்றும் அட்சரம் பெறும்உழைப்பே உயர்வு வாழ்க வளமுடன்,1,"['தங்கள்', 'வார்த்தைகள்', 'ஒவ்வொன்றும்', 'அட்சரம்', 'பெறும்உழைப்பே', 'உயர்வு', 'வாழ்க', 'வளமுடன்']","['தங்கள்', 'வார்த்தைகள்', 'ஒவ்வொன்றும்', 'அட்சரம்', 'பெறும்உழைப்பே', 'உயர்வு', 'வாழ்க', 'வளமுடன்']",தங்கள் வார்த்தைகள் ஒவ்வொன்றும் அட்சரம் பெறும்உழைப்பே உயர்வு வாழ்க வளமுடன்
மூத்திர ரசம் இலவசம்,0,"['மூத்திர', 'ரசம்', 'இலவசம்']","['மூத்திர', 'ரசம்', 'இலவசம்']",மூத்திர ரசம் இலவசம்
பொங்கல் விலை ரூ அளவு கோவிலில் கொடுக்கும் பிரசாதத்தை விட குறைவாக இருக்கும்,-1,"['பொங்கல்', 'விலை', 'ரூ', 'அளவு', 'கோவிலில்', 'கொடுக்கும்', 'பிரசாதத்தை', 'விட', 'குறைவாக', 'இருக்கும்']","['பொங்கல்', 'விலை', 'ரூ', 'அளவு', 'கோவிலில்', 'கொடுக்கும்', 'பிரசாதத்தை', 'விட', 'குறைவாக', 'இருக்கும்']",பொங்கல் விலை ரூ அளவு கோவிலில் கொடுக்கும் பிரசாதத்தை விட குறைவாக இருக்கும்
மதுரையில் வேற கடையே கிடைக்கவில்லையா சுவை என்றால் என்ன விலை என்று கேட்க வைக்கும் விலை மிகவும் அதிகமாக உள்ளது கடலைமாவு சாம்பார்,-1,"['மதுரையில்', 'வேற', 'கடையே', 'கிடைக்கவில்லையா', 'சுவை', 'என்றால்', 'என்ன', 'விலை', 'என்று', 'கேட்க', 'வைக்கும்', 'விலை', 'மிகவும்', 'அதிகமாக', 'உள்ளது', 'கடலைமாவு', 'சாம்பார்']","['மதுரையில்', 'வேற', 'கடையே', 'கிடைக்கவில்லையா', 'சுவை', 'என்றால்', 'என்ன', 'விலை', 'கேட்க', 'வைக்கும்', 'விலை', 'மிகவும்', 'அதிகமாக', 'கடலைமாவு', 'சாம்பார்']",மதுரையில் வேற கடையே கிடைக்கவில்லையா சுவை என்றால் என்ன விலை கேட்க வைக்கும் விலை மிகவும் அதிகமாக கடலைமாவு சாம்பார்
இப்படித்தான் நம்பி வந்தோம் கடைசில அமவுண்ட் அதிகம் சாதா தோசை ரூபாய்,-1,"['இப்படித்தான்', 'நம்பி', 'வந்தோம்', 'கடைசில', 'அமவுண்ட்', 'அதிகம்', 'சாதா', 'தோசை', 'ரூபாய்']","['இப்படித்தான்', 'நம்பி', 'வந்தோம்', 'கடைசில', 'அமவுண்ட்', 'அதிகம்', 'சாதா', 'தோசை', 'ரூபாய்']",இப்படித்தான் நம்பி வந்தோம் கடைசில அமவுண்ட் அதிகம் சாதா தோசை ரூபாய்
வெஸ்ட்,0,['வெஸ்ட்'],['வெஸ்ட்'],வெஸ்ட்
ஆயிடும் டா,1,"['ஆயிடும்', 'டா']","['ஆயிடும்', 'டா']",ஆயிடும் டா
வாழ்த்துக்கள் நண்பரே உழைத்துப்பிழைக்கும் உங்களைப்போன்றவர்களை நாத்திகர்களாகிய நாங்களும் மதிப்பதுண்டு நீங்கள் சாதி பேதம் பார்ப்பவரா என்று எனக்கு தெரியவில்லை அதனால் உழைத்துத்தான் வாழ வேண்டும் என்ற உங்கள் எண்ணத்திற்கு மட்டும் என் வணக்கங்கள் வாழ்த்துக்கள்,-1,"['வாழ்த்துக்கள்', 'நண்பரே', 'உழைத்துப்பிழைக்கும்', 'உங்களைப்போன்றவர்களை', 'நாத்திகர்களாகிய', 'நாங்களும்', 'மதிப்பதுண்டு', 'நீங்கள்', 'சாதி', 'பேதம்', 'பார்ப்பவரா', 'என்று', 'எனக்கு', 'தெரியவில்லை', 'அதனால்', 'உழைத்துத்தான்', 'வாழ', 'வேண்டும்', 'என்ற', 'உங்கள்', 'எண்ணத்திற்கு', 'மட்டும்', 'என்', 'வணக்கங்கள்', 'வாழ்த்துக்கள்']","['வாழ்த்துக்கள்', 'நண்பரே', 'உழைத்துப்பிழைக்கும்', 'உங்களைப்போன்றவர்களை', 'நாத்திகர்களாகிய', 'நாங்களும்', 'மதிப்பதுண்டு', 'நீங்கள்', 'சாதி', 'பேதம்', 'பார்ப்பவரா', 'எனக்கு', 'தெரியவில்லை', 'அதனால்', 'உழைத்துத்தான்', 'வாழ', 'வேண்டும்', 'என்ற', 'உங்கள்', 'எண்ணத்திற்கு', 'மட்டும்', 'வணக்கங்கள்', 'வாழ்த்துக்கள்']",வாழ்த்துக்கள் நண்பரே உழைத்துப்பிழைக்கும் உங்களைப்போன்றவர்களை நாத்திகர்களாகிய நாங்களும் மதிப்பதுண்டு நீங்கள் சாதி பேதம் பார்ப்பவரா எனக்கு தெரியவில்லை அதனால் உழைத்துத்தான் வாழ வேண்டும் என்ற உங்கள் எண்ணத்திற்கு மட்டும் வணக்கங்கள் வாழ்த்துக்கள்
வாழ்த்துக்கள்,1,['வாழ்த்துக்கள்'],['வாழ்த்துக்கள்'],வாழ்த்துக்கள்
தங்கள் நீ ண்ட நாள் வாழ இறைவநீ டம் வேண்டுகிறேன்,1,"['தங்கள்', 'நீ', 'ண்ட', 'நாள்', 'வாழ', 'இறைவநீ', 'டம்', 'வேண்டுகிறேன்']","['தங்கள்', 'நீ', 'ண்ட', 'நாள்', 'வாழ', 'இறைவநீ', 'டம்', 'வேண்டுகிறேன்']",தங்கள் நீ ண்ட நாள் வாழ இறைவநீ டம் வேண்டுகிறேன்
எனக்கு இவர் மனைவியை பார்க்க வேண்டும் என்று இருந்திருக்கிறது,0,"['எனக்கு', 'இவர்', 'மனைவியை', 'பார்க்க', 'வேண்டும்', 'என்று', 'இருந்திருக்கிறது']","['எனக்கு', 'இவர்', 'மனைவியை', 'பார்க்க', 'வேண்டும்', 'இருந்திருக்கிறது']",எனக்கு இவர் மனைவியை பார்க்க வேண்டும் இருந்திருக்கிறது
மனைவி அமைவதெல்லாம் இறைவன் கொடுத்த வரம்,1,"['மனைவி', 'அமைவதெல்லாம்', 'இறைவன்', 'கொடுத்த', 'வரம்']","['மனைவி', 'அமைவதெல்லாம்', 'இறைவன்', 'கொடுத்த', 'வரம்']",மனைவி அமைவதெல்லாம் இறைவன் கொடுத்த வரம்
இது போன்ற வீடியோக்களைப் பார்த்து ஆகி இன்று காலை உணவு இந்த கடைக்குச் சாப்பிடச் சென்றேன் இட்லி பொங்கல் வடை சாம்பார் சட்னி அனைத்தும் படு மோசம் பூரி சற்று பரவாயில்லை உண்மையச் சொல்றேன் தயவுசெய்து போகாதீங்க ஏமாறாதீங்க,-1,"['இது', 'போன்ற', 'வீடியோக்களைப்', 'பார்த்து', 'ஆகி', 'இன்று', 'காலை', 'உணவு', 'இந்த', 'கடைக்குச்', 'சாப்பிடச்', 'சென்றேன்', 'இட்லி', 'பொங்கல்', 'வடை', 'சாம்பார்', 'சட்னி', 'அனைத்தும்', 'படு', 'மோசம்', 'பூரி', 'சற்று', 'பரவாயில்லை', 'உண்மையச்', 'சொல்றேன்', 'தயவுசெய்து', 'போகாதீங்க', 'ஏமாறாதீங்க']","['போன்ற', 'வீடியோக்களைப்', 'பார்த்து', 'ஆகி', 'இன்று', 'காலை', 'உணவு', 'இந்த', 'கடைக்குச்', 'சாப்பிடச்', 'சென்றேன்', 'இட்லி', 'பொங்கல்', 'வடை', 'சாம்பார்', 'சட்னி', 'அனைத்தும்', 'படு', 'மோசம்', 'பூரி', 'சற்று', 'பரவாயில்லை', 'உண்மையச்', 'சொல்றேன்', 'தயவுசெய்து', 'போகாதீங்க', 'ஏமாறாதீங்க']",போன்ற வீடியோக்களைப் பார்த்து ஆகி இன்று காலை உணவு இந்த கடைக்குச் சாப்பிடச் சென்றேன் இட்லி பொங்கல் வடை சாம்பார் சட்னி அனைத்தும் படு மோசம் பூரி சற்று பரவாயில்லை உண்மையச் சொல்றேன் தயவுசெய்து போகாதீங்க ஏமாறாதீங்க
நானும் ஒரு நாள் ரயில்வே ஸ்டேஷனி லிருந்து நடந்து போனேன் என் நேரம் கடை பூட்டியிருந்தது கண் அறுவை சிகிச் ச்சை காரணமாக கடை லீவுனு எழுதிருந்தது,-1,"['நானும்', 'ஒரு', 'நாள்', 'ரயில்வே', 'ஸ்டேஷனி', 'லிருந்து', 'நடந்து', 'போனேன்', 'என்', 'நேரம்', 'கடை', 'பூட்டியிருந்தது', 'கண்', 'அறுவை', 'சிகிச்', 'ச்சை', 'காரணமாக', 'கடை', 'லீவுனு', 'எழுதிருந்தது']","['நானும்', 'நாள்', 'ரயில்வே', 'ஸ்டேஷனி', 'லிருந்து', 'நடந்து', 'போனேன்', 'நேரம்', 'கடை', 'பூட்டியிருந்தது', 'கண்', 'அறுவை', 'சிகிச்', 'ச்சை', 'காரணமாக', 'கடை', 'லீவுனு', 'எழுதிருந்தது']",நானும் நாள் ரயில்வே ஸ்டேஷனி லிருந்து நடந்து போனேன் நேரம் கடை பூட்டியிருந்தது கண் அறுவை சிகிச் ச்சை காரணமாக கடை லீவுனு எழுதிருந்தது
காரணம் எழுதி கடை மூடியது உங்கள் வாடிக்கையாளர்கள் மீது உள்ள அக்கறையை காட்டுகிறது,0,"['காரணம்', 'எழுதி', 'கடை', 'மூடியது', 'உங்கள்', 'வாடிக்கையாளர்கள்', 'மீது', 'உள்ள', 'அக்கறையை', 'காட்டுகிறது']","['காரணம்', 'எழுதி', 'கடை', 'மூடியது', 'உங்கள்', 'வாடிக்கையாளர்கள்', 'மீது', 'உள்ள', 'அக்கறையை', 'காட்டுகிறது']",காரணம் எழுதி கடை மூடியது உங்கள் வாடிக்கையாளர்கள் மீது உள்ள அக்கறையை காட்டுகிறது
மீனாட்சியை வழிபட மதுரை வந்தால் கண்டிப்பா உங்க உணவகத்தில் கண்டிப்பாக சாப்பிடுவேன்,1,"['மீனாட்சியை', 'வழிபட', 'மதுரை', 'வந்தால்', 'கண்டிப்பா', 'உங்க', 'உணவகத்தில்', 'கண்டிப்பாக', 'சாப்பிடுவேன்']","['மீனாட்சியை', 'வழிபட', 'மதுரை', 'வந்தால்', 'கண்டிப்பா', 'உங்க', 'உணவகத்தில்', 'கண்டிப்பாக', 'சாப்பிடுவேன்']",மீனாட்சியை வழிபட மதுரை வந்தால் கண்டிப்பா உங்க உணவகத்தில் கண்டிப்பாக சாப்பிடுவேன்
ஐயா நீங்க பேசிய ஒவ்வொரு வார்த்தைகளையும் உண்மையுள்ளது ஐயா,-1,"['ஐயா', 'நீங்க', 'பேசிய', 'ஒவ்வொரு', 'வார்த்தைகளையும்', 'உண்மையுள்ளது', 'ஐயா']","['ஐயா', 'நீங்க', 'பேசிய', 'ஒவ்வொரு', 'வார்த்தைகளையும்', 'உண்மையுள்ளது', 'ஐயா']",ஐயா நீங்க பேசிய ஒவ்வொரு வார்த்தைகளையும் உண்மையுள்ளது ஐயா
காசு கொடுத்தா எல்லாமே கிடைக்கும் ஆனால் அன்புக்காக தன் வரங்க,-1,"['காசு', 'கொடுத்தா', 'எல்லாமே', 'கிடைக்கும்', 'ஆனால்', 'அன்புக்காக', 'தன்', 'வரங்க']","['காசு', 'கொடுத்தா', 'எல்லாமே', 'கிடைக்கும்', 'ஆனால்', 'அன்புக்காக', 'தன்', 'வரங்க']",காசு கொடுத்தா எல்லாமே கிடைக்கும் ஆனால் அன்புக்காக தன் வரங்க
உண்மையில் மீனாட்சி அம்மன் தான் அந்த அம்மா,-1,"['உண்மையில்', 'மீனாட்சி', 'அம்மன்', 'தான்', 'அந்த', 'அம்மா']","['உண்மையில்', 'மீனாட்சி', 'அம்மன்', 'தான்', 'அந்த', 'அம்மா']",உண்மையில் மீனாட்சி அம்மன் தான் அந்த அம்மா
