Comment,Sentiment,tokens,filtered_tokens,processed_text
தங்க பிள்ளை குமரன்,1,"['தங்க', 'பிள்ளை', 'குமரன்']","['தங்க', 'பிள்ளை', 'குமரன்']",தங்க பிள்ளை குமரன்
முத்து நாய்க் காக பிபி கொண்டாட்டம் பார்க்காமே இருந்துடலாம் னு தோணுது சவுண்ட் காக மட்டும் பார்ப்பேன்,-1,"['முத்து', 'நாய்க்', 'காக', 'பிபி', 'கொண்டாட்டம்', 'பார்க்காமே', 'இருந்துடலாம்', 'னு', 'தோணுது', 'சவுண்ட்', 'காக', 'மட்டும்', 'பார்ப்பேன்']","['முத்து', 'நாய்க்', 'காக', 'பிபி', 'கொண்டாட்டம்', 'பார்க்காமே', 'இருந்துடலாம்', 'னு', 'தோணுது', 'சவுண்ட்', 'காக', 'மட்டும்', 'பார்ப்பேன்']",முத்து நாய்க் காக பிபி கொண்டாட்டம் பார்க்காமே இருந்துடலாம் னு தோணுது சவுண்ட் காக மட்டும் பார்ப்பேன்
குமரா அண்ணி ஜெயிச்சுட்டட,0,"['குமரா', 'அண்ணி', 'ஜெயிச்சுட்டட']","['குமரா', 'அண்ணி', 'ஜெயிச்சுட்டட']",குமரா அண்ணி ஜெயிச்சுட்டட
முத்து வாழ்க தமிழ் வாழ்க,1,"['முத்து', 'வாழ்க', 'தமிழ்', 'வாழ்க']","['முத்து', 'வாழ்க', 'தமிழ்', 'வாழ்க']",முத்து வாழ்க தமிழ் வாழ்க
முத்துவின் வெற்றி தமிழுக்கு கிடைத்து வெற்றி,1,"['முத்துவின்', 'வெற்றி', 'தமிழுக்கு', 'கிடைத்து', 'வெற்றி']","['முத்துவின்', 'வெற்றி', 'தமிழுக்கு', 'கிடைத்து', 'வெற்றி']",முத்துவின் வெற்றி தமிழுக்கு கிடைத்து வெற்றி
தீபக் மனைவி படிக்காதவராகவும் கலாச்சாரமற்றவராகவும் கண்மூடித்தனமாக கணவனுக்கு ஆதரவாக இருக்கிறார் ஈவ் டீசிங் இருக்கிறது ஆனால் அடம் டீசிங் இல்லை பெண் உடலும் ஆண் உடலும் ஒரே மாதிரி இருப்பதில்லை தீபக் விஷாலுடன் சௌந்தர்யாவை அவமானப்படுத்தினார் அவர் அதை ஆதரிக்கிறார் இரக்கமற்ற மனைவி அவமானம் அவர்களுக்கு அருண் அவர்களைப் பற்றி சரியாகச் சொன்னார் அவர்கள் எல்லோரையும் விட உயர்ந்தவர்கள் என்று நினைக்கிறார்கள்,0,"['தீபக்', 'மனைவி', 'படிக்காதவராகவும்', 'கலாச்சாரமற்றவராகவும்', 'கண்மூடித்தனமாக', 'கணவனுக்கு', 'ஆதரவாக', 'இருக்கிறார்', 'ஈவ்', 'டீசிங்', 'இருக்கிறது', 'ஆனால்', 'அடம்', 'டீசிங்', 'இல்லை', 'பெண்', 'உடலும்', 'ஆண்', 'உடலும்', 'ஒரே', 'மாதிரி', 'இருப்பதில்லை', 'தீபக்', 'விஷாலுடன்', 'சௌந்தர்யாவை', 'அவமானப்படுத்தினார்', 'அவர்', 'அதை', 'ஆதரிக்கிறார்', 'இரக்கமற்ற', 'மனைவி', 'அவமானம்', 'அவர்களுக்கு', 'அருண்', 'அவர்களைப்', 'பற்றி', 'சரியாகச்', 'சொன்னார்', 'அவர்கள்', 'எல்லோரையும்', 'விட', 'உயர்ந்தவர்கள்', 'என்று', 'நினைக்கிறார்கள்']","['தீபக்', 'மனைவி', 'படிக்காதவராகவும்', 'கலாச்சாரமற்றவராகவும்', 'கண்மூடித்தனமாக', 'கணவனுக்கு', 'ஆதரவாக', 'இருக்கிறார்', 'ஈவ்', 'டீசிங்', 'இருக்கிறது', 'ஆனால்', 'அடம்', 'டீசிங்', 'பெண்', 'உடலும்', 'ஆண்', 'உடலும்', 'ஒரே', 'மாதிரி', 'இருப்பதில்லை', 'தீபக்', 'விஷாலுடன்', 'சௌந்தர்யாவை', 'அவமானப்படுத்தினார்', 'அவர்', 'அதை', 'ஆதரிக்கிறார்', 'இரக்கமற்ற', 'மனைவி', 'அவமானம்', 'அவர்களுக்கு', 'அருண்', 'அவர்களைப்', 'பற்றி', 'சரியாகச்', 'சொன்னார்', 'அவர்கள்', 'எல்லோரையும்', 'விட', 'உயர்ந்தவர்கள்', 'நினைக்கிறார்கள்']",தீபக் மனைவி படிக்காதவராகவும் கலாச்சாரமற்றவராகவும் கண்மூடித்தனமாக கணவனுக்கு ஆதரவாக இருக்கிறார் ஈவ் டீசிங் இருக்கிறது ஆனால் அடம் டீசிங் பெண் உடலும் ஆண் உடலும் ஒரே மாதிரி இருப்பதில்லை தீபக் விஷாலுடன் சௌந்தர்யாவை அவமானப்படுத்தினார் அவர் அதை ஆதரிக்கிறார் இரக்கமற்ற மனைவி அவமானம் அவர்களுக்கு அருண் அவர்களைப் பற்றி சரியாகச் சொன்னார் அவர்கள் எல்லோரையும் விட உயர்ந்தவர்கள் நினைக்கிறார்கள்
முத்துக்குமாரன் டைட்டில் வின்னர் சிங்கடா அண்ணா,1,"['முத்துக்குமாரன்', 'டைட்டில்', 'வின்னர்', 'சிங்கடா', 'அண்ணா']","['முத்துக்குமாரன்', 'டைட்டில்', 'வின்னர்', 'சிங்கடா', 'அண்ணா']",முத்துக்குமாரன் டைட்டில் வின்னர் சிங்கடா அண்ணா
௭ங்கள் முத்து,1,"['௭ங்கள்', 'முத்து']","['௭ங்கள்', 'முத்து']",௭ங்கள் முத்து
நீங்களும் உங்கள் அன்புக் குடும்பமும் நட்பும் வாழ்க வளமுடன்,1,"['நீங்களும்', 'உங்கள்', 'அன்புக்', 'குடும்பமும்', 'நட்பும்', 'வாழ்க', 'வளமுடன்']","['நீங்களும்', 'உங்கள்', 'அன்புக்', 'குடும்பமும்', 'நட்பும்', 'வாழ்க', 'வளமுடன்']",நீங்களும் உங்கள் அன்புக் குடும்பமும் நட்பும் வாழ்க வளமுடன்
குமரா,1,['குமரா'],['குமரா'],குமரா
முத்து தம்பி வாழ்க வளமுடன்,1,"['முத்து', 'தம்பி', 'வாழ்க', 'வளமுடன்']","['முத்து', 'தம்பி', 'வாழ்க', 'வளமுடன்']",முத்து தம்பி வாழ்க வளமுடன்
இருக்குற பண பிரச்சனைய இல்லாம பண்றத்துக்கு இல்லாத பல பிரச்சனைய இருக்குற மாதிரி பண்றத்துக்கு இரண்டுதுக்கும் ஒரே இடம் இந்த பிக்பாஸ்,-1,"['இருக்குற', 'பண', 'பிரச்சனைய', 'இல்லாம', 'பண்றத்துக்கு', 'இல்லாத', 'பல', 'பிரச்சனைய', 'இருக்குற', 'மாதிரி', 'பண்றத்துக்கு', 'இரண்டுதுக்கும்', 'ஒரே', 'இடம்', 'இந்த', 'பிக்பாஸ்']","['இருக்குற', 'பண', 'பிரச்சனைய', 'இல்லாம', 'பண்றத்துக்கு', 'இல்லாத', 'பல', 'பிரச்சனைய', 'இருக்குற', 'மாதிரி', 'பண்றத்துக்கு', 'இரண்டுதுக்கும்', 'ஒரே', 'இடம்', 'இந்த', 'பிக்பாஸ்']",இருக்குற பண பிரச்சனைய இல்லாம பண்றத்துக்கு இல்லாத பல பிரச்சனைய இருக்குற மாதிரி பண்றத்துக்கு இரண்டுதுக்கும் ஒரே இடம் இந்த பிக்பாஸ்
குமார,1,['குமார'],['குமார'],குமார
ஓம் நமோ லஷ்மி நாராயணா,1,"['ஓம்', 'நமோ', 'லஷ்மி', 'நாராயணா']","['ஓம்', 'நமோ', 'லஷ்மி', 'நாராயணா']",ஓம் நமோ லஷ்மி நாராயணா
ஓம் சிவ சக்தி,1,"['ஓம்', 'சிவ', 'சக்தி']","['ஓம்', 'சிவ', 'சக்தி']",ஓம் சிவ சக்தி
நன்றி,1,['நன்றி'],['நன்றி'],நன்றி
நன்றி அம்மா,1,"['நன்றி', 'அம்மா']","['நன்றி', 'அம்மா']",நன்றி அம்மா
அம்மா உங்களை எனக்கு ரொம்ப பிடிக்கும்,-1,"['அம்மா', 'உங்களை', 'எனக்கு', 'ரொம்ப', 'பிடிக்கும்']","['அம்மா', 'உங்களை', 'எனக்கு', 'ரொம்ப', 'பிடிக்கும்']",அம்மா உங்களை எனக்கு ரொம்ப பிடிக்கும்
நன்றி அம்மா,1,"['நன்றி', 'அம்மா']","['நன்றி', 'அம்மா']",நன்றி அம்மா
அம்மா நானும் தினமும் விளக்கு எதுவாயின் அம்மா,0,"['அம்மா', 'நானும்', 'தினமும்', 'விளக்கு', 'எதுவாயின்', 'அம்மா']","['அம்மா', 'நானும்', 'தினமும்', 'விளக்கு', 'எதுவாயின்', 'அம்மா']",அம்மா நானும் தினமும் விளக்கு எதுவாயின் அம்மா
அம்மா நான் பூஜை பண்ணும் பொழுது ஏதோ ஒன்னு தடங்கல் ஆகுது எதனாலிங்கம்மா,-1,"['அம்மா', 'நான்', 'பூஜை', 'பண்ணும்', 'பொழுது', 'ஏதோ', 'ஒன்னு', 'தடங்கல்', 'ஆகுது', 'எதனாலிங்கம்மா']","['அம்மா', 'பூஜை', 'பண்ணும்', 'பொழுது', 'ஏதோ', 'ஒன்னு', 'தடங்கல்', 'ஆகுது', 'எதனாலிங்கம்மா']",அம்மா பூஜை பண்ணும் பொழுது ஏதோ ஒன்னு தடங்கல் ஆகுது எதனாலிங்கம்மா
மந்திரம் ஒலிக்க செய்கிறேன் அம்மா சாம்பிராணி விளக்கு ஏற்றுவது மணி அடித்து பூஜை செய்வது பின்பற்றுகிரேன் அம்மா நன்றி அம்மா,1,"['மந்திரம்', 'ஒலிக்க', 'செய்கிறேன்', 'அம்மா', 'சாம்பிராணி', 'விளக்கு', 'ஏற்றுவது', 'மணி', 'அடித்து', 'பூஜை', 'செய்வது', 'பின்பற்றுகிரேன்', 'அம்மா', 'நன்றி', 'அம்மா']","['மந்திரம்', 'ஒலிக்க', 'செய்கிறேன்', 'அம்மா', 'சாம்பிராணி', 'விளக்கு', 'ஏற்றுவது', 'மணி', 'அடித்து', 'பூஜை', 'செய்வது', 'பின்பற்றுகிரேன்', 'அம்மா', 'நன்றி', 'அம்மா']",மந்திரம் ஒலிக்க செய்கிறேன் அம்மா சாம்பிராணி விளக்கு ஏற்றுவது மணி அடித்து பூஜை செய்வது பின்பற்றுகிரேன் அம்மா நன்றி அம்மா
வைகுண்ட ஏகாதசி விரதம் பற்றி சொல்லுங்க,-1,"['வைகுண்ட', 'ஏகாதசி', 'விரதம்', 'பற்றி', 'சொல்லுங்க']","['வைகுண்ட', 'ஏகாதசி', 'விரதம்', 'பற்றி', 'சொல்லுங்க']",வைகுண்ட ஏகாதசி விரதம் பற்றி சொல்லுங்க
நீங்கள் சொல்வது சரிதான் அம்மா,1,"['நீங்கள்', 'சொல்வது', 'சரிதான்', 'அம்மா']","['நீங்கள்', 'சொல்வது', 'சரிதான்', 'அம்மா']",நீங்கள் சொல்வது சரிதான் அம்மா
கந்த சஷ்டி கவசம் உங்கள் குரலில் போடுங்க அம்மா,1,"['கந்த', 'சஷ்டி', 'கவசம்', 'உங்கள்', 'குரலில்', 'போடுங்க', 'அம்மா']","['கந்த', 'சஷ்டி', 'கவசம்', 'உங்கள்', 'குரலில்', 'போடுங்க', 'அம்மா']",கந்த சஷ்டி கவசம் உங்கள் குரலில் போடுங்க அம்மா
அம்மா எனக்கு மன குழப்பம் உள்ளது நாங்கள் சாமி அரை புதுசாக போட்டோம் அதில் ஒரு பக்கம் விநாயகர் வைத்து செய்து உள்ளோம் எந்த ஹில்ஸ் உம் இல்ல கட்காற்று வர போக வழி இல்லை எப்படி குடது என்று சொல்ராக சிலர் இருக்கலாமா குடதா கூடாத,-1,"['அம்மா', 'எனக்கு', 'மன', 'குழப்பம்', 'உள்ளது', 'நாங்கள்', 'சாமி', 'அரை', 'புதுசாக', 'போட்டோம்', 'அதில்', 'ஒரு', 'பக்கம்', 'விநாயகர்', 'வைத்து', 'செய்து', 'உள்ளோம்', 'எந்த', 'ஹில்ஸ்', 'உம்', 'இல்ல', 'கட்காற்று', 'வர', 'போக', 'வழி', 'இல்லை', 'எப்படி', 'குடது', 'என்று', 'சொல்ராக', 'சிலர்', 'இருக்கலாமா', 'குடதா', 'கூடாத']","['அம்மா', 'எனக்கு', 'மன', 'குழப்பம்', 'நாங்கள்', 'சாமி', 'அரை', 'புதுசாக', 'போட்டோம்', 'அதில்', 'பக்கம்', 'விநாயகர்', 'வைத்து', 'செய்து', 'உள்ளோம்', 'எந்த', 'ஹில்ஸ்', 'உம்', 'இல்ல', 'கட்காற்று', 'வர', 'போக', 'வழி', 'எப்படி', 'குடது', 'சொல்ராக', 'சிலர்', 'இருக்கலாமா', 'குடதா', 'கூடாத']",அம்மா எனக்கு மன குழப்பம் நாங்கள் சாமி அரை புதுசாக போட்டோம் அதில் பக்கம் விநாயகர் வைத்து செய்து உள்ளோம் எந்த ஹில்ஸ் உம் இல்ல கட்காற்று வர போக வழி எப்படி குடது சொல்ராக சிலர் இருக்கலாமா குடதா கூடாத
அம்மா நாங்க அபார்ட்மென்ட்ல இருக்கோம் எங்க வீட்டுக்கு எதிர்வீட்டுல முஸ்லிம் வீடு இருக்காங்க நாங்க வடைக்குக்கு குடி இருக்கிற வீடும் முஸ்லிம் வீடுதான் நீங்க சொல்றமாறி நான் காலைல பூஜைசெய்யுறேன் ஆனா மணி அடிச்சா சத்தம் கேட்க்குறானல பக்கத்து வீட்டுல இருக்கிறவங்களுக்கு எல்லாம் தொந்தரவா இருக்குமோனு கஷ்டமா இருக்கு அதனால நான் மணி அடிக்கறது இல்ல பரவால்லையா ரெண்டாவது பூஜை செய்யும்போது வாசல் கதவு கட்டாயம் திறந்து இருக்கணுமா எங்க வீடு வடக்கு நோக்கி அமைந்திருக்கிறது கிழக்கு பக்கமாக பால்கனி இருக்கிறது வாசலை மூடிவிட்டு கிழக்கு பக்கம் இருக்கும் பால்கனியை திறந்துவிட்டு பூஜை செய்யலாமா காலையில் தயவுசெய்து எனது சந்தேகத்தை தீர்த்து வையுங்கள்,-1,"['அம்மா', 'நாங்க', 'அபார்ட்மென்ட்ல', 'இருக்கோம்', 'எங்க', 'வீட்டுக்கு', 'எதிர்வீட்டுல', 'முஸ்லிம்', 'வீடு', 'இருக்காங்க', 'நாங்க', 'வடைக்குக்கு', 'குடி', 'இருக்கிற', 'வீடும்', 'முஸ்லிம்', 'வீடுதான்', 'நீங்க', 'சொல்றமாறி', 'நான்', 'காலைல', 'பூஜைசெய்யுறேன்', 'ஆனா', 'மணி', 'அடிச்சா', 'சத்தம்', 'கேட்க்குறானல', 'பக்கத்து', 'வீட்டுல', 'இருக்கிறவங்களுக்கு', 'எல்லாம்', 'தொந்தரவா', 'இருக்குமோனு', 'கஷ்டமா', 'இருக்கு', 'அதனால', 'நான்', 'மணி', 'அடிக்கறது', 'இல்ல', 'பரவால்லையா', 'ரெண்டாவது', 'பூஜை', 'செய்யும்போது', 'வாசல்', 'கதவு', 'கட்டாயம்', 'திறந்து', 'இருக்கணுமா', 'எங்க', 'வீடு', 'வடக்கு', 'நோக்கி', 'அமைந்திருக்கிறது', 'கிழக்கு', 'பக்கமாக', 'பால்கனி', 'இருக்கிறது', 'வாசலை', 'மூடிவிட்டு', 'கிழக்கு', 'பக்கம்', 'இருக்கும்', 'பால்கனியை', 'திறந்துவிட்டு', 'பூஜை', 'செய்யலாமா', 'காலையில்', 'தயவுசெய்து', 'எனது', 'சந்தேகத்தை', 'தீர்த்து', 'வையுங்கள்']","['அம்மா', 'நாங்க', 'அபார்ட்மென்ட்ல', 'இருக்கோம்', 'எங்க', 'வீட்டுக்கு', 'எதிர்வீட்டுல', 'முஸ்லிம்', 'வீடு', 'இருக்காங்க', 'நாங்க', 'வடைக்குக்கு', 'குடி', 'இருக்கிற', 'வீடும்', 'முஸ்லிம்', 'வீடுதான்', 'நீங்க', 'சொல்றமாறி', 'காலைல', 'பூஜைசெய்யுறேன்', 'ஆனா', 'மணி', 'அடிச்சா', 'சத்தம்', 'கேட்க்குறானல', 'பக்கத்து', 'வீட்டுல', 'இருக்கிறவங்களுக்கு', 'எல்லாம்', 'தொந்தரவா', 'இருக்குமோனு', 'கஷ்டமா', 'இருக்கு', 'அதனால', 'மணி', 'அடிக்கறது', 'இல்ல', 'பரவால்லையா', 'ரெண்டாவது', 'பூஜை', 'செய்யும்போது', 'வாசல்', 'கதவு', 'கட்டாயம்', 'திறந்து', 'இருக்கணுமா', 'எங்க', 'வீடு', 'வடக்கு', 'நோக்கி', 'அமைந்திருக்கிறது', 'கிழக்கு', 'பக்கமாக', 'பால்கனி', 'இருக்கிறது', 'வாசலை', 'மூடிவிட்டு', 'கிழக்கு', 'பக்கம்', 'இருக்கும்', 'பால்கனியை', 'திறந்துவிட்டு', 'பூஜை', 'செய்யலாமா', 'காலையில்', 'தயவுசெய்து', 'எனது', 'சந்தேகத்தை', 'தீர்த்து', 'வையுங்கள்']",அம்மா நாங்க அபார்ட்மென்ட்ல இருக்கோம் எங்க வீட்டுக்கு எதிர்வீட்டுல முஸ்லிம் வீடு இருக்காங்க நாங்க வடைக்குக்கு குடி இருக்கிற வீடும் முஸ்லிம் வீடுதான் நீங்க சொல்றமாறி காலைல பூஜைசெய்யுறேன் ஆனா மணி அடிச்சா சத்தம் கேட்க்குறானல பக்கத்து வீட்டுல இருக்கிறவங்களுக்கு எல்லாம் தொந்தரவா இருக்குமோனு கஷ்டமா இருக்கு அதனால மணி அடிக்கறது இல்ல பரவால்லையா ரெண்டாவது பூஜை செய்யும்போது வாசல் கதவு கட்டாயம் திறந்து இருக்கணுமா எங்க வீடு வடக்கு நோக்கி அமைந்திருக்கிறது கிழக்கு பக்கமாக பால்கனி இருக்கிறது வாசலை மூடிவிட்டு கிழக்கு பக்கம் இருக்கும் பால்கனியை திறந்துவிட்டு பூஜை செய்யலாமா காலையில் தயவுசெய்து எனது சந்தேகத்தை தீர்த்து வையுங்கள்
