Comment,Sentiment,tokens,filtered_tokens,processed_text
ஒரு நொடி உடல் சிலிர்த்தது அருமைமிகச்சிறந்த விளக்கம் ஆகச்சிறந்த படைப்புகளின் சேகரிப்புகள் பள்ளிப் புத்தகம் போன்றவற்றில் வீட்டு நூலகம் பற்றி படித்திருக்கிறேன் இப்படி ஒன்று உண்மையிலேயே இப்பவும் இருக்குனு பாக்கும் போது சந்தோசமா இருக்கு இந்த மலையளவு கடலளவு நூல்களுள் நான் கடுகளவு வாசித்துள்ளேன் என்பதில் உள்ளுக்குள் மகிழ்ச்சி கலாட்டா இப்போதான் ஒரு உருப்படியான தேவையான காணொலி பதிவு செஞ்சிருக்கிங்க இதோட விட்டுடாம தொடர்ந்து செஞ்சா நல்லா இருக்கும்,-1,"['ஒரு', 'நொடி', 'உடல்', 'சிலிர்த்தது', 'அருமைமிகச்சிறந்த', 'விளக்கம்', 'ஆகச்சிறந்த', 'படைப்புகளின்', 'சேகரிப்புகள்', 'பள்ளிப்', 'புத்தகம்', 'போன்றவற்றில்', 'வீட்டு', 'நூலகம்', 'பற்றி', 'படித்திருக்கிறேன்', 'இப்படி', 'ஒன்று', 'உண்மையிலேயே', 'இப்பவும்', 'இருக்குனு', 'பாக்கும்', 'போது', 'சந்தோசமா', 'இருக்கு', 'இந்த', 'மலையளவு', 'கடலளவு', 'நூல்களுள்', 'நான்', 'கடுகளவு', 'வாசித்துள்ளேன்', 'என்பதில்', 'உள்ளுக்குள்', 'மகிழ்ச்சி', 'கலாட்டா', 'இப்போதான்', 'ஒரு', 'உருப்படியான', 'தேவையான', 'காணொலி', 'பதிவு', 'செஞ்சிருக்கிங்க', 'இதோட', 'விட்டுடாம', 'தொடர்ந்து', 'செஞ்சா', 'நல்லா', 'இருக்கும்']","['நொடி', 'உடல்', 'சிலிர்த்தது', 'அருமைமிகச்சிறந்த', 'விளக்கம்', 'ஆகச்சிறந்த', 'படைப்புகளின்', 'சேகரிப்புகள்', 'பள்ளிப்', 'புத்தகம்', 'போன்றவற்றில்', 'வீட்டு', 'நூலகம்', 'பற்றி', 'படித்திருக்கிறேன்', 'இப்படி', 'ஒன்று', 'உண்மையிலேயே', 'இப்பவும்', 'இருக்குனு', 'பாக்கும்', 'போது', 'சந்தோசமா', 'இருக்கு', 'இந்த', 'மலையளவு', 'கடலளவு', 'நூல்களுள்', 'கடுகளவு', 'வாசித்துள்ளேன்', 'என்பதில்', 'உள்ளுக்குள்', 'மகிழ்ச்சி', 'கலாட்டா', 'இப்போதான்', 'உருப்படியான', 'தேவையான', 'காணொலி', 'பதிவு', 'செஞ்சிருக்கிங்க', 'இதோட', 'விட்டுடாம', 'தொடர்ந்து', 'செஞ்சா', 'நல்லா', 'இருக்கும்']",நொடி உடல் சிலிர்த்தது அருமைமிகச்சிறந்த விளக்கம் ஆகச்சிறந்த படைப்புகளின் சேகரிப்புகள் பள்ளிப் புத்தகம் போன்றவற்றில் வீட்டு நூலகம் பற்றி படித்திருக்கிறேன் இப்படி ஒன்று உண்மையிலேயே இப்பவும் இருக்குனு பாக்கும் போது சந்தோசமா இருக்கு இந்த மலையளவு கடலளவு நூல்களுள் கடுகளவு வாசித்துள்ளேன் என்பதில் உள்ளுக்குள் மகிழ்ச்சி கலாட்டா இப்போதான் உருப்படியான தேவையான காணொலி பதிவு செஞ்சிருக்கிங்க இதோட விட்டுடாம தொடர்ந்து செஞ்சா நல்லா இருக்கும்
மனுஷன் கொழந்த மாதிரி மாறி புத்தகங்கள பத்தி பேசராருயா,-1,"['மனுஷன்', 'கொழந்த', 'மாதிரி', 'மாறி', 'புத்தகங்கள', 'பத்தி', 'பேசராருயா']","['மனுஷன்', 'கொழந்த', 'மாதிரி', 'மாறி', 'புத்தகங்கள', 'பத்தி', 'பேசராருயா']",மனுஷன் கொழந்த மாதிரி மாறி புத்தகங்கள பத்தி பேசராருயா
புத்தகம் வைச்சிருக்கவன் எல்லாம் அமைதியா இருக்கான் புத்தகம் வைச்சிருக்கிற மிஷ்கின் பன்ற அளப்பற இருக்கே அய்யய்யோ,-1,"['புத்தகம்', 'வைச்சிருக்கவன்', 'எல்லாம்', 'அமைதியா', 'இருக்கான்', 'புத்தகம்', 'வைச்சிருக்கிற', 'மிஷ்கின்', 'பன்ற', 'அளப்பற', 'இருக்கே', 'அய்யய்யோ']","['புத்தகம்', 'வைச்சிருக்கவன்', 'எல்லாம்', 'அமைதியா', 'இருக்கான்', 'புத்தகம்', 'வைச்சிருக்கிற', 'மிஷ்கின்', 'பன்ற', 'அளப்பற', 'இருக்கே', 'அய்யய்யோ']",புத்தகம் வைச்சிருக்கவன் எல்லாம் அமைதியா இருக்கான் புத்தகம் வைச்சிருக்கிற மிஷ்கின் பன்ற அளப்பற இருக்கே அய்யய்யோ
வார்த்தைகள் இல்லை மெய்சிலிர்க்க வைக்கிறது உணர்வுபூர்வமான வாழ்த்துக்கள்,-1,"['வார்த்தைகள்', 'இல்லை', 'மெய்சிலிர்க்க', 'வைக்கிறது', 'உணர்வுபூர்வமான', 'வாழ்த்துக்கள்']","['வார்த்தைகள்', 'மெய்சிலிர்க்க', 'வைக்கிறது', 'உணர்வுபூர்வமான', 'வாழ்த்துக்கள்']",வார்த்தைகள் மெய்சிலிர்க்க வைக்கிறது உணர்வுபூர்வமான வாழ்த்துக்கள்
என்னா படுச்சு என்ன ப்ரீயோஜனம்,-1,"['என்னா', 'படுச்சு', 'என்ன', 'ப்ரீயோஜனம்']","['என்னா', 'படுச்சு', 'என்ன', 'ப்ரீயோஜனம்']",என்னா படுச்சு என்ன ப்ரீயோஜனம்
சமுத்திரக்கனி யின் இந்த முகம் ஆச்சரியப்படுத்துகிறது படிப்பாளிய் இருக்கும் படைப்பாளிகளின் வெற்றி உறுதியானது,1,"['சமுத்திரக்கனி', 'யின்', 'இந்த', 'முகம்', 'ஆச்சரியப்படுத்துகிறது', 'படிப்பாளிய்', 'இருக்கும்', 'படைப்பாளிகளின்', 'வெற்றி', 'உறுதியானது']","['சமுத்திரக்கனி', 'யின்', 'இந்த', 'முகம்', 'ஆச்சரியப்படுத்துகிறது', 'படிப்பாளிய்', 'இருக்கும்', 'படைப்பாளிகளின்', 'வெற்றி', 'உறுதியானது']",சமுத்திரக்கனி யின் இந்த முகம் ஆச்சரியப்படுத்துகிறது படிப்பாளிய் இருக்கும் படைப்பாளிகளின் வெற்றி உறுதியானது
அருமை,0,['அருமை'],['அருமை'],அருமை
அண்ணன் உண்மையாகவே ஒரு மா மனிதர்,-1,"['அண்ணன்', 'உண்மையாகவே', 'ஒரு', 'மா', 'மனிதர்']","['அண்ணன்', 'உண்மையாகவே', 'மா', 'மனிதர்']",அண்ணன் உண்மையாகவே மா மனிதர்
இவர் சிறப்பாக பேசும்போதே சிறந்த பேச்சு திறமை உள்ளவராகவும் இருக்கிறார்னு சின்ன சந்தேகம் இருந்தது அது ஊர்ஜிதம் ஆயிருச்சு இவ்வளவு அறிவு எங்கிருந்து வந்ததுன்னு சூப்பர் சூப்பர்,0,"['இவர்', 'சிறப்பாக', 'பேசும்போதே', 'சிறந்த', 'பேச்சு', 'திறமை', 'உள்ளவராகவும்', 'இருக்கிறார்னு', 'சின்ன', 'சந்தேகம்', 'இருந்தது', 'அது', 'ஊர்ஜிதம்', 'ஆயிருச்சு', 'இவ்வளவு', 'அறிவு', 'எங்கிருந்து', 'வந்ததுன்னு', 'சூப்பர்', 'சூப்பர்']","['இவர்', 'சிறப்பாக', 'பேசும்போதே', 'சிறந்த', 'பேச்சு', 'திறமை', 'உள்ளவராகவும்', 'இருக்கிறார்னு', 'சின்ன', 'சந்தேகம்', 'இருந்தது', 'அது', 'ஊர்ஜிதம்', 'ஆயிருச்சு', 'இவ்வளவு', 'அறிவு', 'எங்கிருந்து', 'வந்ததுன்னு', 'சூப்பர்', 'சூப்பர்']",இவர் சிறப்பாக பேசும்போதே சிறந்த பேச்சு திறமை உள்ளவராகவும் இருக்கிறார்னு சின்ன சந்தேகம் இருந்தது அது ஊர்ஜிதம் ஆயிருச்சு இவ்வளவு அறிவு எங்கிருந்து வந்ததுன்னு சூப்பர் சூப்பர்
சமுத்திரகனி அண்ணே தமிழ் காமிக்ஸ் புத்தகம் இருக்கா,1,"['சமுத்திரகனி', 'அண்ணே', 'தமிழ்', 'காமிக்ஸ்', 'புத்தகம்', 'இருக்கா']","['சமுத்திரகனி', 'அண்ணே', 'தமிழ்', 'காமிக்ஸ்', 'புத்தகம்', 'இருக்கா']",சமுத்திரகனி அண்ணே தமிழ் காமிக்ஸ் புத்தகம் இருக்கா
ஒரு நடிகனின் நூலகம்,1,"['ஒரு', 'நடிகனின்', 'நூலகம்']","['நடிகனின்', 'நூலகம்']",நடிகனின் நூலகம்
சமுத்திரகனி நாயுடு,1,"['சமுத்திரகனி', 'நாயுடு']","['சமுத்திரகனி', 'நாயுடு']",சமுத்திரகனி நாயுடு
அருமை சமுத்திரகனி சார்,1,"['அருமை', 'சமுத்திரகனி', 'சார்']","['அருமை', 'சமுத்திரகனி', 'சார்']",அருமை சமுத்திரகனி சார்
ஜெயமோகன் ஆண்டுகளிலையே பக்கங்கள் கொண்ட பாகமாக வெண்முரசை எழுதினார் வெண்முரசு புத்தக வாசிப்பை நேசிப்பவர்களுக்கு கிடைத்த வரம் நான் பாகம் படிச்சாச்சு மீதி பாகங்களையும் படிக்க வேணும் இலங்கையில் புத்தகங்களின் விலைதான் அதிகம்,1,"['ஜெயமோகன்', 'ஆண்டுகளிலையே', 'பக்கங்கள்', 'கொண்ட', 'பாகமாக', 'வெண்முரசை', 'எழுதினார்', 'வெண்முரசு', 'புத்தக', 'வாசிப்பை', 'நேசிப்பவர்களுக்கு', 'கிடைத்த', 'வரம்', 'நான்', 'பாகம்', 'படிச்சாச்சு', 'மீதி', 'பாகங்களையும்', 'படிக்க', 'வேணும்', 'இலங்கையில்', 'புத்தகங்களின்', 'விலைதான்', 'அதிகம்']","['ஜெயமோகன்', 'ஆண்டுகளிலையே', 'பக்கங்கள்', 'கொண்ட', 'பாகமாக', 'வெண்முரசை', 'எழுதினார்', 'வெண்முரசு', 'புத்தக', 'வாசிப்பை', 'நேசிப்பவர்களுக்கு', 'கிடைத்த', 'வரம்', 'பாகம்', 'படிச்சாச்சு', 'மீதி', 'பாகங்களையும்', 'படிக்க', 'வேணும்', 'இலங்கையில்', 'புத்தகங்களின்', 'விலைதான்', 'அதிகம்']",ஜெயமோகன் ஆண்டுகளிலையே பக்கங்கள் கொண்ட பாகமாக வெண்முரசை எழுதினார் வெண்முரசு புத்தக வாசிப்பை நேசிப்பவர்களுக்கு கிடைத்த வரம் பாகம் படிச்சாச்சு மீதி பாகங்களையும் படிக்க வேணும் இலங்கையில் புத்தகங்களின் விலைதான் அதிகம்
ஆமாங்க நீங்கள் சொல்வது சரிதான் இலங்கையில் புத்தகங்களின் விலை எக்கச்சக்கம்,-1,"['ஆமாங்க', 'நீங்கள்', 'சொல்வது', 'சரிதான்', 'இலங்கையில்', 'புத்தகங்களின்', 'விலை', 'எக்கச்சக்கம்']","['ஆமாங்க', 'நீங்கள்', 'சொல்வது', 'சரிதான்', 'இலங்கையில்', 'புத்தகங்களின்', 'விலை', 'எக்கச்சக்கம்']",ஆமாங்க நீங்கள் சொல்வது சரிதான் இலங்கையில் புத்தகங்களின் விலை எக்கச்சக்கம்
கருத்து கந்தசாமி,1,"['கருத்து', 'கந்தசாமி']","['கருத்து', 'கந்தசாமி']",கருத்து கந்தசாமி
கனி அண்ணா உண்மையாகவே அறம் அறத்தை விதைக்கிறது என்னுள் விதைத்து உள்ளது ஏற்கனவே நமக்குள் இருக்கும் அறத்தை அழிக்காமல் காக்க உதவுகிறது மகிழ்ச்சியாக உள்ளது,-1,"['கனி', 'அண்ணா', 'உண்மையாகவே', 'அறம்', 'அறத்தை', 'விதைக்கிறது', 'என்னுள்', 'விதைத்து', 'உள்ளது', 'ஏற்கனவே', 'நமக்குள்', 'இருக்கும்', 'அறத்தை', 'அழிக்காமல்', 'காக்க', 'உதவுகிறது', 'மகிழ்ச்சியாக', 'உள்ளது']","['கனி', 'அண்ணா', 'உண்மையாகவே', 'அறம்', 'அறத்தை', 'விதைக்கிறது', 'என்னுள்', 'விதைத்து', 'ஏற்கனவே', 'நமக்குள்', 'இருக்கும்', 'அறத்தை', 'அழிக்காமல்', 'காக்க', 'உதவுகிறது', 'மகிழ்ச்சியாக']",கனி அண்ணா உண்மையாகவே அறம் அறத்தை விதைக்கிறது என்னுள் விதைத்து ஏற்கனவே நமக்குள் இருக்கும் அறத்தை அழிக்காமல் காக்க உதவுகிறது மகிழ்ச்சியாக
இவன் ஒரு திருட்டு நாதரி,1,"['இவன்', 'ஒரு', 'திருட்டு', 'நாதரி']","['இவன்', 'திருட்டு', 'நாதரி']",இவன் திருட்டு நாதரி
உலகத்திலே மிக அதிக புத்தகம் படித்து முடித்தவர் ஓஷோ அவர்கள் தான் நூலகத்தை நேசியுங்கள்,-1,"['உலகத்திலே', 'மிக', 'அதிக', 'புத்தகம்', 'படித்து', 'முடித்தவர்', 'ஓஷோ', 'அவர்கள்', 'தான்', 'நூலகத்தை', 'நேசியுங்கள்']","['உலகத்திலே', 'மிக', 'அதிக', 'புத்தகம்', 'படித்து', 'முடித்தவர்', 'ஓஷோ', 'அவர்கள்', 'தான்', 'நூலகத்தை', 'நேசியுங்கள்']",உலகத்திலே மிக அதிக புத்தகம் படித்து முடித்தவர் ஓஷோ அவர்கள் தான் நூலகத்தை நேசியுங்கள்
நல்ல காணொளி,1,"['நல்ல', 'காணொளி']","['நல்ல', 'காணொளி']",நல்ல காணொளி
சமுத்திர க்கனிசமுத்திர,1,"['சமுத்திர', 'க்கனிசமுத்திர']","['சமுத்திர', 'க்கனிசமுத்திர']",சமுத்திர க்கனிசமுத்திர
திருக்குறள்,1,['திருக்குறள்'],['திருக்குறள்'],திருக்குறள்
தில்லானா மோகனாம்பாள் கொத்தமங்கலம் சுப்பு,0,"['தில்லானா', 'மோகனாம்பாள்', 'கொத்தமங்கலம்', 'சுப்பு']","['தில்லானா', 'மோகனாம்பாள்', 'கொத்தமங்கலம்', 'சுப்பு']",தில்லானா மோகனாம்பாள் கொத்தமங்கலம் சுப்பு
அருமை ஐயா துரைராஜ் கும்பகோணம் என்னுடைய கவிதை நூல் உறவாடும் கவிதைகள் தங்களுக்குஅனுப்பவேண்டும்,1,"['அருமை', 'ஐயா', 'துரைராஜ்', 'கும்பகோணம்', 'என்னுடைய', 'கவிதை', 'நூல்', 'உறவாடும்', 'கவிதைகள்', 'தங்களுக்குஅனுப்பவேண்டும்']","['அருமை', 'ஐயா', 'துரைராஜ்', 'கும்பகோணம்', 'என்னுடைய', 'கவிதை', 'நூல்', 'உறவாடும்', 'கவிதைகள்', 'தங்களுக்குஅனுப்பவேண்டும்']",அருமை ஐயா துரைராஜ் கும்பகோணம் என்னுடைய கவிதை நூல் உறவாடும் கவிதைகள் தங்களுக்குஅனுப்பவேண்டும்
சூப்பர் சார்வாழ்த்துக்கள் நூலகர் ரெங்கராஜன்புதுக்கோட்டைமாவட்டம்ஆலங்குடிதாலுகாபள்ளத்திவிடுதிஊராட்சி,1,"['சூப்பர்', 'சார்வாழ்த்துக்கள்', 'நூலகர்', 'ரெங்கராஜன்புதுக்கோட்டைமாவட்டம்ஆலங்குடிதாலுகாபள்ளத்திவிடுதிஊராட்சி']","['சூப்பர்', 'சார்வாழ்த்துக்கள்', 'நூலகர்', 'ரெங்கராஜன்புதுக்கோட்டைமாவட்டம்ஆலங்குடிதாலுகாபள்ளத்திவிடுதிஊராட்சி']",சூப்பர் சார்வாழ்த்துக்கள் நூலகர் ரெங்கராஜன்புதுக்கோட்டைமாவட்டம்ஆலங்குடிதாலுகாபள்ளத்திவிடுதிஊராட்சி
உடையார் நாவலை இவ்வாறு தொகுத்து வழங்கினால் மகிழ்ச்சி,-1,"['உடையார்', 'நாவலை', 'இவ்வாறு', 'தொகுத்து', 'வழங்கினால்', 'மகிழ்ச்சி']","['உடையார்', 'நாவலை', 'இவ்வாறு', 'தொகுத்து', 'வழங்கினால்', 'மகிழ்ச்சி']",உடையார் நாவலை இவ்வாறு தொகுத்து வழங்கினால் மகிழ்ச்சி
அருமையான பதிவு அண்ணா,0,"['அருமையான', 'பதிவு', 'அண்ணா']","['அருமையான', 'பதிவு', 'அண்ணா']",அருமையான பதிவு அண்ணா
மிகவும் சிறப்பாக இருந்தது,1,"['மிகவும்', 'சிறப்பாக', 'இருந்தது']","['மிகவும்', 'சிறப்பாக', 'இருந்தது']",மிகவும் சிறப்பாக இருந்தது
நல்லா இருக்கு ஆனால் உங்கள் காணொளி எல்லாம் ரொம்ப மெதுவாக இருக்கிறது,0,"['நல்லா', 'இருக்கு', 'ஆனால்', 'உங்கள்', 'காணொளி', 'எல்லாம்', 'ரொம்ப', 'மெதுவாக', 'இருக்கிறது']","['நல்லா', 'இருக்கு', 'ஆனால்', 'உங்கள்', 'காணொளி', 'எல்லாம்', 'ரொம்ப', 'மெதுவாக', 'இருக்கிறது']",நல்லா இருக்கு ஆனால் உங்கள் காணொளி எல்லாம் ரொம்ப மெதுவாக இருக்கிறது
அருமையான பதிவு,1,"['அருமையான', 'பதிவு']","['அருமையான', 'பதிவு']",அருமையான பதிவு
அருமையான பதிவு அண்ணா,0,"['அருமையான', 'பதிவு', 'அண்ணா']","['அருமையான', 'பதிவு', 'அண்ணா']",அருமையான பதிவு அண்ணா
